<?xml version="1.0" encoding="UTF-8"?>
<?xml-stylesheet type="text/xsl" href="http://jsbsim.sf.net/JSBSimScript.xsl"?>
<runscript xmlns:xsi="http://www.w3.org/2001/XMLSchema-instance"
    xsi:noNamespaceSchemaLocation="http://jsbsim.sf.net/JSBSimScript.xsd"
    name="X-15-01A">
  <description>Testing the X-15</description>
  <use aircraft="X15" initialize="reset01"/>
  <run start="0.0" end="10.0" dt="0.01">
    <event name="Set elevator">
      <condition>simulation/sim-time-sec  ge  0.0</condition>
      <set name="fcs/elevator-cmd-norm" action="FG_STEP" type="FG_VALUE" value="-1.0" tc="0.5"/>
      <notify/>
    </event>
  </run>
</runscript>
